{
  "$schema": "https://json-schema.org/draft/2020-12/schema",
  "type": "object",
  "properties": {
    "$schema": {
      "type": "string",
      "format": "uri",
      "title": "JSON Schema URI",
      "description": "URI of the JSON Schema used to validate this record",
      "example": "https://raw.githubusercontent.com/carrot-foundation/schemas/refs/heads/main/schemas/ipfs/shared/base/base.schema.json"
    },
    "schema": {
      "type": "object",
      "properties": {
        "hash": {
          "type": "string",
          "pattern": "^[a-f0-9]{64}$",
          "title": "Schema Hash",
          "description": "SHA-256 hash of the JSON Schema this record was validated against",
          "examples": [
            "87f633634cc4b02f628685651f0a29b7bfa22a0bd841f725c6772dd00a58d489"
          ]
        },
        "type": {
          "type": "string",
          "const": "Collection",
          "title": "Collection Schema Type",
          "description": "Discriminator value identifying this record as a Collection grouping of credits and receipts"
        },
        "version": {
          "type": "string",
          "minLength": 1,
          "pattern": "^v?\\d+\\.\\d+\\.\\d+(-[a-zA-Z0-9.-]+)?(\\+[a-zA-Z0-9.-]+)?$",
          "title": "Schema Version",
          "description": "Version of the schema, using semantic versioning",
          "examples": [
            "0.1.0",
            "1.0.0",
            "2.1.3"
          ]
        },
        "ipfs_uri": {
          "type": "string",
          "minLength": 1,
          "pattern": "^ipfs:\\/\\/(?:Qm[1-9A-HJ-NP-Za-km-z]{44}|[bB][a-z2-7]{58,}|[zZ][1-9A-HJ-NP-Za-km-z]{48,})(?:\\/[^\\s]*)?$",
          "title": "Schema IPFS URI",
          "description": "IPFS URI for this JSON Schema when the primary schema URI is unavailable",
          "examples": [
            "ipfs://bafybeigdyrztvzl5cceubvaxob7iqh6f3f7s36c74ojav2xsz2uib2g3vm",
            "ipfs://bafybeihdwdcefgh4dqkjv67uzcmw7ojee6xedzdetojuzjevtenxquvyku"
          ]
        }
      },
      "required": [
        "hash",
        "type",
        "version",
        "ipfs_uri"
      ],
      "additionalProperties": false
    },
    "created_at": {
      "type": "string",
      "format": "date-time",
      "pattern": "^(?:(?:\\d\\d[2468][048]|\\d\\d[13579][26]|\\d\\d0[48]|[02468][048]00|[13579][26]00)-02-29|\\d{4}-(?:(?:0[13578]|1[02])-(?:0[1-9]|[12]\\d|3[01])|(?:0[469]|11)-(?:0[1-9]|[12]\\d|30)|(?:02)-(?:0[1-9]|1\\d|2[0-8])))T(?:(?:[01]\\d|2[0-3]):[0-5]\\d(?::[0-5]\\d(?:\\.\\d+)?)?(?:Z|([+-](?:[01]\\d|2[0-3]):[0-5]\\d)))$",
      "title": "Created At",
      "description": "ISO 8601 creation timestamp for this record",
      "examples": [
        "2024-12-05T11:02:47.000Z"
      ]
    },
    "external_id": {
      "type": "string",
      "format": "uuid",
      "pattern": "^([0-9a-fA-F]{8}-[0-9a-fA-F]{4}-4[0-9a-fA-F]{3}-[89abAB][0-9a-fA-F]{3}-[0-9a-fA-F]{12})$",
      "title": "External ID",
      "description": "UUID v4 identifier linking this IPFS record to its counterpart in the Carrot platform and other consuming systems",
      "examples": [
        "ad44dd3f-f176-4b98-bf78-5ee6e77d0530"
      ]
    },
    "external_url": {
      "type": "string",
      "format": "uri",
      "title": "External URL",
      "description": "URL pointing to external resources",
      "examples": [
        "https://registry.carrot.eco/",
        "https://whitepaper.carrot.eco/"
      ]
    },
    "viewer_reference": {
      "type": "object",
      "properties": {
        "ipfs_uri": {
          "type": "string",
          "minLength": 1,
          "pattern": "^ipfs:\\/\\/(?:Qm[1-9A-HJ-NP-Za-km-z]{44}|[bB][a-z2-7]{58,}|[zZ][1-9A-HJ-NP-Za-km-z]{48,})(?:\\/[^\\s]*)?$",
          "title": "Viewer IPFS URI",
          "description": "IPFS URI of the metadata viewer dApp build",
          "examples": [
            "ipfs://bafybeigdyrztvzl5cceubvaxob7iqh6f3f7s36c74ojav2xsz2uib2g3vm",
            "ipfs://bafybeihdwdcefgh4dqkjv67uzcmw7ojee6xedzdetojuzjevtenxquvyku"
          ]
        }
      },
      "required": [
        "ipfs_uri"
      ],
      "additionalProperties": false,
      "title": "Metadata Viewer Reference",
      "description": "Immutable reference to the metadata viewer dApp build. The IPFS CID itself is the integrity proof: tampered content resolves to a different CID"
    },
    "environment": {
      "type": "object",
      "properties": {
        "blockchain_network": {
          "type": "string",
          "enum": [
            "mainnet",
            "testnet"
          ],
          "title": "Blockchain Network",
          "description": "Blockchain network where this record is deployed"
        },
        "deployment": {
          "type": "string",
          "enum": [
            "production",
            "development",
            "testing"
          ],
          "title": "Deployment Environment",
          "description": "System environment where this record was generated"
        },
        "data_set_name": {
          "type": "string",
          "enum": [
            "TEST",
            "PROD"
          ],
          "title": "Data Set Name",
          "description": "Name of the data set for this record"
        }
      },
      "required": [
        "blockchain_network",
        "deployment",
        "data_set_name"
      ],
      "additionalProperties": false,
      "title": "Record Environment",
      "description": "Environment information for the record"
    },
    "data": {
      "title": "Custom Data",
      "description": "Collection-specific data payload",
      "type": "object",
      "propertyNames": {
        "type": "string"
      },
      "additionalProperties": {}
    },
    "name": {
      "type": "string",
      "minLength": 1,
      "maxLength": 100,
      "title": "Collection Name",
      "description": "Human-readable display name for the environmental credit collection",
      "examples": [
        "BOLD Cold Start - Araucária",
        "BOLD Cold Start - Papagaios"
      ]
    },
    "slug": {
      "type": "string",
      "minLength": 1,
      "maxLength": 100,
      "pattern": "^[a-z0-9-]+$",
      "title": "Collection Slug",
      "description": "URL-friendly identifier for an environmental credit collection, used in URIs and API references",
      "examples": [
        "bold-cold-start-araucaria",
        "bold-cold-start-papagaios"
      ]
    },
    "image": {
      "type": "string",
      "minLength": 1,
      "pattern": "^ipfs:\\/\\/(?:Qm[1-9A-HJ-NP-Za-km-z]{44}|[bB][a-z2-7]{58,}|[zZ][1-9A-HJ-NP-Za-km-z]{48,})(?:\\/[^\\s]*)?$",
      "title": "Collection Image",
      "description": "IPFS URI pointing to the collection's visual representation",
      "examples": [
        "ipfs://bafybeihdwdcefgh4dqkjv67uzcmw7ojee6xedzdetojuzjevtenxquvyku"
      ]
    },
    "description": {
      "type": "string",
      "minLength": 50,
      "maxLength": 1000,
      "title": "Collection Description",
      "description": "Comprehensive description of the collection, its purpose, and context",
      "examples": [
        "Cold Start is a limited-edition collection created for early supporters of BOLD - Breakthrough in Organic Landfill Diversion. This purchase contributes to reducing global waste and promoting circularity, with funds distributed via smart contract to local recycling operations and communities."
      ]
    }
  },
  "required": [
    "$schema",
    "schema",
    "created_at",
    "external_id",
    "external_url",
    "name",
    "slug",
    "image",
    "description"
  ],
  "additionalProperties": false,
  "title": "Collection IPFS Record",
  "description": "Collection metadata stored in IPFS, extending the base schema with collection-specific fields used to group and organize credit purchases and retirements in Carrot's ecosystem",
  "$id": "https://raw.githubusercontent.com/carrot-foundation/schemas/refs/tags/v5.1.0/schemas/ipfs/collection/collection.schema.json",
  "version": "5.1.0"
}
