{
  "$schema": "https://raw.githubusercontent.com/carrot-foundation/schemas/refs/tags/v5.1.1/schemas/ipfs/collection/collection.schema.json",
  "schema": {
    "hash": "7eda6bd7879d74ecbb16607fb83d9a4bab567c72d8b82db3e4273c5cd60e3628",
    "type": "Collection",
    "version": "5.1.1",
    "ipfs_uri": "ipfs://bafybeigdyrztvzl5cceubvaxob7iqh6f3f7s36c74ojav2xsz2uib2g3vm"
  },
  "environment": {
    "blockchain_network": "testnet",
    "deployment": "development",
    "data_set_name": "TEST"
  },
  "created_at": "2024-12-05T14:30:00.000Z",
  "external_id": "8f2c3445-ef89-4de7-8d95-7c814d5c8af9",
  "external_url": "https://registry.carrot.eco/collection/bold-cold-start-carazinho",
  "name": "BOLD Cold Start - Carazinho",
  "slug": "bold-cold-start-carazinho",
  "image": "ipfs://bafybeihdwdcefgh4dqkjv67uzcmw7ojee6xedzdetojuzjevtenxquvyku",
  "description": "Cold Start is a limited-edition collection created for early supporters of BOLD - Breakthrough in Organic Landfill Diversion. This purchase contributes to reducing global waste and promoting circularity, with funds distributed via smart contract to local recycling operations and communities."
}
